{
	"name": "main",
	"target": "branch",
	"enforcement": "active",
	"conditions": { "ref_name": { "include": ["refs/heads/main"], "exclude": [] } },
	"bypass_actors": [],
	"rules": [
		{ "type": "deletion" },
		{ "type": "non_fast_forward" },
		{
			"type": "pull_request",
			"parameters": {
				"allowed_merge_methods": ["squash"],
				"required_approving_review_count": 0,
				"dismiss_stale_reviews_on_push": false,
				"require_code_owner_review": false,
				"require_last_push_approval": false,
				"required_review_thread_resolution": true
			}
		},
		{
			"type": "required_status_checks",
			"parameters": {
				"strict_required_status_checks_policy": false,
				"do_not_enforce_on_create": false,
				"required_status_checks": [
					{ "context": "lint", "integration_id": 15368 },
					{ "context": "flake", "integration_id": 15368 },
					{ "context": "pr-policy", "integration_id": 15368 }
				]
			}
		}
	]
}
